Sheet: List-1
A1: A | B1: B | C1: C
A2: 1 | B2: =ABS(RC[-1]*3) -> 3 | C2: =MAX(RC[-2],RC[-1]) -> 3
A3: =R[-1]C+2 -> 3 | B3: =ABS(RC[-1]*3) -> 9 | C3: =MAX(RC[-2],RC[-1]) -> 9
A4: =R[-1]C+2 -> 5 | B4: =ABS(RC[-1]*3) -> 15 | C4: =MAX(RC[-2],RC[-1]) -> 15
A5: =R[-1]C+2 -> 7 | B5: =ABS(RC[-1]*3) -> 21 | C5: =MAX(RC[-2],RC[-1]) -> 21
A6: =R[-1]C+2 -> 9 | B6: =ABS(RC[-1]*3) -> 27 | C6: =MAX(RC[-2],RC[-1]) -> 27
A7: =R[-1]C+2 -> 11 | B7: =ABS(RC[-1]*3) -> 33 | C7: =MAX(RC[-2],RC[-1]) -> 33
A8: =R[-1]C+2 -> 13 | B8: =ABS(RC[-1]*3) -> 39 | C8: =MAX(RC[-2],RC[-1]) -> 39
A9: =R[-1]C+2 -> 15 | B9: =ABS(RC[-1]*3) -> 45 | C9: =MAX(RC[-2],RC[-1]) -> 45

Sheet: List-2
A1: A | B1: B | C1: C
A2: 1 | B2: =ABS(RC[-1]*3) -> 3 | C2: =MAX(RC[-2],RC[-1]) -> 3
A3: =R[-1]C+2 -> 3 | B3: =ABS(RC[-1]*3) -> 9 | C3: =MAX(RC[-2],RC[-1]) -> 9
A4: =R[-1]C+2 -> 5 | B4: =ABS(RC[-1]*3) -> 15 | C4: =MAX(RC[-2],RC[-1]) -> 15
A5: =R[-1]C+2 -> 7 | B5: =ABS(RC[-1]*3) -> 21 | C5: =MAX(RC[-2],RC[-1]) -> 21
A6: =R[-1]C+2 -> 9 | B6: =ABS(RC[-1]*3) -> 27 | C6: =MAX(RC[-2],RC[-1]) -> 27
A7: =R[-1]C+2 -> 11 | B7: =ABS(RC[-1]*3) -> 33 | C7: =MAX(RC[-2],RC[-1]) -> 33
A8: =R[-1]C+2 -> 13 | B8: =ABS(RC[-1]*3) -> 39 | C8: =MAX(RC[-2],RC[-1]) -> 39
A9: =R[-1]C+2 -> 15 | B9: =ABS(RC[-1]*3) -> 45 | C9: =MAX(RC[-2],RC[-1]) -> 45

Sheet: List-3
A1: A | B1: B | C1: C | D1: D
A2: 1 | B2: =ABS(RC[-1]*3) -> 3 | C2: =MAX(RC[-2],RC[-1]) -> 3 | D2: A/a
A3: =R[-1]C+2 -> 3 | B3: =ABS(RC[-1]*3) -> 9 | C3: =MAX(RC[-2],RC[-1]) -> 9 | D3: A\a
A4: =R[-1]C+2 -> 5 | B4: =ABS(RC[-1]*3) -> 15 | C4: =MAX(RC[-2],RC[-1]) -> 15 | D4: A<>a
A5: =R[-1]C+2 -> 7 | B5: =ABS(RC[-1]*3) -> 21 | C5: =MAX(RC[-2],RC[-1]) -> 21
A6: =R[-1]C+2 -> 9 | B6: =ABS(RC[-1]*3) -> 27 | C6: =MAX(RC[-2],RC[-1]) -> 27
A7: =R[-1]C+2 -> 11 | B7: =ABS(RC[-1]*3) -> 33 | C7: =MAX(RC[-2],RC[-1]) -> 33
A8: =R[-1]C+2 -> 13 | B8: =ABS(RC[-1]*3) -> 39 | C8: =MAX(RC[-2],RC[-1]) -> 39
A9: =R[-1]C+2 -> 15 | B9: =ABS(RC[-1]*3) -> 45 | C9: =MAX(RC[-2],RC[-1]) -> 45